content_id,title,tags,type
C0199,Strategic Planning Trends to Watch in 2024,"strategic planning,trends,industry,future,innovation,entrepreneurship management",article
C0200,Deep Dive into Financial Analysis Algorithms,"financial analysis,machine learning,algorithms,data science,python,finance banking",tutorial
C0201,Personal Branding Best Practices for 2024,"personal branding,best practices,software,engineering,tips,marketing communication",tips
C0202,How to Measure Color Theory Success,"color theory,KPIs,metrics,measurement,performance,design creative",guide
C0203,How to Optimize Smart Contracts Performance,"smart contracts,optimization,performance,engineering,advanced,finance banking",article
C0204,Deep Dive into Conversion Rate Algorithms,"conversion rate,machine learning,algorithms,data science,python,marketing communication",tutorial
C0205,Web3 Interview Questions and Answers,"web3,interview,hiring,recruitment,career,finance banking",tips
C0206,Building a Strong Pedagogy Culture,"pedagogy,culture,team,management,leadership,education training",article
C0207,User Research Marketing Strategy That Actually Works,"user research,marketing,strategy,growth,ROI,design creative",article
C0208,Deep Dive into GraphQL Algorithms,"graphql,machine learning,algorithms,data science,python,it software development",tutorial
C0209,Getting Started with React,"react,beginner,introduction,learning,guide,it software development",guide
C0210,How to Build a Successful CRM Strategy,"crm,strategy,business,growth,planning,sales business development",article
C0211,How to Measure Prototyping Success,"prototyping,KPIs,metrics,measurement,performance,design creative",guide
C0212,Introduction to Curriculum Design with Python,"python,curriculum design,beginner,tutorial,programming,education training",tutorial
C0213,Leveraging Blockchain for Business Growth,"blockchain,growth,business,strategy,marketing,finance banking",article
C0214,How to Measure Change Management Success,"change management,KPIs,metrics,measurement,performance,entrepreneurship management",guide
C0215,How to Build a Successful Growth Hacking Strategy,"growth hacking,strategy,business,growth,planning,marketing communication",article
C0216,How Microlearning is Changing the Industry,"microlearning,innovation,digital transformation,future,business,education training",article
C0217,Mastering Data Pipelines: From Zero to Hero,"data pipelines,learning,career,skills,progression,data analytics",guide
C0218,How to Build a Successful Negotiation Strategy,"negotiation,strategy,business,growth,planning,sales business development",article
C0219,VC Marketing Strategy That Actually Works,"vc,marketing,strategy,growth,ROI,finance banking",article
C0220,Deep Dive into Blockchain Algorithms,"blockchain,machine learning,algorithms,data science,python,finance banking",tutorial
C0221,How to Build a Successful Onboarding Strategy,"onboarding,strategy,business,growth,planning,human resources",article
C0222,Leveraging Design Thinking for Business Growth,"design thinking,growth,business,strategy,marketing,design creative",article
C0223,Financial Analysis Trends to Watch in 2024,"financial analysis,trends,industry,future,innovation,finance banking",article
C0224,Deep Dive into Microlearning Algorithms,"microlearning,machine learning,algorithms,data science,python,education training",tutorial
C0225,Real-world SEO Case Studies,"seo,case study,industry,applications,business,marketing communication",article
C0226,Building a Design Thinking Pipeline from Scratch,"design thinking,python,engineering,hands-on,step-by-step,design creative",tutorial
C0227,OKRs Best Practices for 2024,"okrs,best practices,software,engineering,tips,entrepreneurship management",tips
C0228,How to Measure Neural Networks Success,"neural networks,KPIs,metrics,measurement,performance,data analytics",guide
C0229,Top 10 Tools for Machine Learning Professionals,"machine learning,tools,productivity,software,recommendations,it software development",tips
C0230,Getting Started with LMS,"lms,beginner,introduction,learning,guide,education training",guide
C0231,Mastering Social Media: From Zero to Hero,"social media,learning,career,skills,progression,marketing communication",guide
C0232,How Growth Hacking is Changing the Industry,"growth hacking,innovation,digital transformation,future,business,entrepreneurship management",article
C0233,Deep Dive into Google Ads Algorithms,"google ads,machine learning,algorithms,data science,python,marketing communication",tutorial
C0234,Deep Learning Trends to Watch in 2024,"deep learning,trends,industry,future,innovation,it software development",article
C0235,How to Measure Diversity & Inclusion Success,"diversity & inclusion,KPIs,metrics,measurement,performance,human resources",guide
C0236,How to Optimize Illustration Performance,"illustration,optimization,performance,engineering,advanced,design creative",article
C0237,Leveraging Online Teaching for Business Growth,"online teaching,growth,business,strategy,marketing,education training",article
C0238,Partnership Trends to Watch in 2024,"partnership,trends,industry,future,innovation,sales business development",article
C0239,Building a SaaS Sales Pipeline from Scratch,"saas sales,python,engineering,hands-on,step-by-step,sales business development",tutorial
C0240,The Complete Guide to Account Management,"account management,guide,comprehensive,professional,learning,sales business development",guide
C0241,Introduction to Figma with Python,"python,figma,beginner,tutorial,programming,design creative",tutorial
C0242,Building a Strong System Design Culture,"system design,culture,team,management,leadership,it software development",article
C0243,The Complete Guide to UX Design,"ux design,guide,comprehensive,professional,learning,design creative",guide
C0244,Introduction to Motion Design with Python,"python,motion design,beginner,tutorial,programming,design creative",tutorial
C0245,The Complete Guide to Pedagogy,"pedagogy,guide,comprehensive,professional,learning,education training",guide
C0246,Real-world Gamification Case Studies,"gamification,case study,industry,applications,business,education training",article
C0247,Real-world Copywriting Case Studies,"copywriting,case study,industry,applications,business,marketing communication",article
C0248,Building a Branding Pipeline from Scratch,"branding,python,engineering,hands-on,step-by-step,design creative",tutorial
C0249,Google Ads Best Practices for 2024,"google ads,best practices,software,engineering,tips,marketing communication",tips
C0250,Leveraging Revenue Growth for Business Growth,"revenue growth,growth,business,strategy,marketing,sales business development",article
C0251,Introduction to Sales Pipeline with Python,"python,sales pipeline,beginner,tutorial,programming,sales business development",tutorial
C0252,Introduction to Content Marketing with Python,"python,content marketing,beginner,tutorial,programming,marketing communication",tutorial
C0253,Getting Started with Email Marketing,"email marketing,beginner,introduction,learning,guide,marketing communication",guide
C0254,Real-world Marketing Analytics Case Studies,"marketing analytics,case study,industry,applications,business,marketing communication",article
C0255,Building a Strong Computer Vision Culture,"computer vision,culture,team,management,leadership,data analytics",article
C0256,Mastering Business Model: From Zero to Hero,"business model,learning,career,skills,progression,entrepreneurship management",guide
C0257,Advanced Cold Outreach Techniques in Python,"python,cold outreach,advanced,data science,programming,sales business development",tutorial
C0258,Advanced Talent Acquisition Techniques in Python,"python,talent acquisition,advanced,data science,programming,human resources",tutorial
C0259,Building a Color Theory Pipeline from Scratch,"color theory,python,engineering,hands-on,step-by-step,design creative",tutorial
C0260,Microlearning vs LMS: A Complete Comparison,"microlearning,lms,comparison,analysis,engineering,education training",comparison
C0261,Introduction to Visual Identity with Python,"python,visual identity,beginner,tutorial,programming,design creative",tutorial
C0262,Real-world SQL Case Studies,"sql,case study,industry,applications,business,data analytics",article
C0263,Advanced Web3 Techniques in Python,"python,web3,advanced,data science,programming,finance banking",tutorial
C0264,Innovation Interview Questions and Answers,"innovation,interview,hiring,recruitment,career,entrepreneurship management",tips
C0265,Mastering Networking: From Zero to Hero,"networking,learning,career,skills,progression,entrepreneurship management",guide
C0266,Advanced Employer Branding Techniques in Python,"python,employer branding,advanced,data science,programming,human resources",tutorial
C0267,Advanced Design Systems Techniques in Python,"python,design systems,advanced,data science,programming,design creative",tutorial
C0268,The Complete Guide to Agile,"agile,guide,comprehensive,professional,learning,entrepreneurship management",guide
C0269,Getting Started with Recruitment,"recruitment,beginner,introduction,learning,guide,human resources",guide
C0270,Introduction to Data Pipelines with Python,"python,data pipelines,beginner,tutorial,programming,data analytics",tutorial
C0271,Building a Strong Cloud Architecture Culture,"cloud architecture,culture,team,management,leadership,it software development",article
C0272,Real-world Video Marketing Case Studies,"video marketing,case study,industry,applications,business,marketing communication",article
C0273,Leveraging Conversion Rate for Business Growth,"conversion rate,growth,business,strategy,marketing,marketing communication",article
C0274,Advanced People Analytics Techniques in Python,"python,people analytics,advanced,data science,programming,human resources",tutorial
C0275,How to Measure People Analytics Success,"people analytics,KPIs,metrics,measurement,performance,human resources",guide
C0276,Real-world Computer Vision Case Studies,"computer vision,case study,industry,applications,business,data analytics",article
C0277,Learning & Development Trends to Watch in 2024,"learning & development,trends,industry,future,innovation,human resources",article
C0278,Top 10 Tools for Sales Pipeline Professionals,"sales pipeline,tools,productivity,software,recommendations,sales business development",tips
C0279,Getting Started with Compensation,"compensation,beginner,introduction,learning,guide,human resources",guide
C0280,How MongoDB is Changing the Industry,"mongodb,innovation,digital transformation,future,business,it software development",article
C0281,Building a Strong Curriculum Design Culture,"curriculum design,culture,team,management,leadership,education training",article
C0282,Online Teaching Interview Questions and Answers,"online teaching,interview,hiring,recruitment,career,education training",tips
C0283,Getting Started with Marketing Analytics,"marketing analytics,beginner,introduction,learning,guide,marketing communication",guide
C0284,Introduction to Pedagogy with Python,"python,pedagogy,beginner,tutorial,programming,education training",tutorial
C0285,Deep Dive into Gamification Algorithms,"gamification,machine learning,algorithms,data science,python,education training",tutorial
C0286,Cybersecurity Trends to Watch in 2024,"cybersecurity,trends,industry,future,innovation,it software development",article
C0287,How to Measure Business Model Success,"business model,KPIs,metrics,measurement,performance,entrepreneurship management",guide
C0288,Building a Strong Investment Culture,"investment,culture,team,management,leadership,finance banking",article
C0289,Mastering Online Teaching: From Zero to Hero,"online teaching,learning,career,skills,progression,education training",guide
C0290,How to Build a Successful Employee Engagement Strategy,"employee engagement,strategy,business,growth,planning,human resources",article
C0291,Building a NLP Pipeline from Scratch,"nlp,python,engineering,hands-on,step-by-step,data analytics",tutorial
C0292,Deep Dive into Flutter Algorithms,"flutter,machine learning,algorithms,data science,python,it software development",tutorial
C0293,Building a Strong React Culture,"react,culture,team,management,leadership,it software development",article
C0294,Agile Marketing Strategy That Actually Works,"agile,marketing,strategy,growth,ROI,entrepreneurship management",article
C0295,VC Interview Questions and Answers,"vc,interview,hiring,recruitment,career,finance banking",tips
C0296,Real-world UX Design Case Studies,"ux design,case study,industry,applications,business,design creative",article
C0297,Building a Strong TF-IDF Culture,"tf-idf,culture,team,management,leadership,data analytics",article
C0298,Advanced Model Evaluation Techniques in Python,"python,model evaluation,advanced,data science,programming,data analytics",tutorial
C0299,Getting Started with Flutter,"flutter,beginner,introduction,learning,guide,it software development",guide
C0300,Building a E-learning Pipeline from Scratch,"e-learning,python,engineering,hands-on,step-by-step,education training",tutorial
