content_id,title,tags,type
C0001,Leveraging VC for Business Growth,"vc,growth,business,strategy,marketing,finance banking",article
C0002,The Complete Guide to Learning & Development,"learning & development,guide,comprehensive,professional,learning,human resources",guide
C0003,How to Build a Successful Fundraising Strategy,"fundraising,strategy,business,growth,planning,entrepreneurship management",article
C0004,How to Optimize Typography Performance,"typography,optimization,performance,engineering,advanced,design creative",article
C0005,Mastering Community Management: From Zero to Hero,"community management,learning,career,skills,progression,marketing communication",guide
C0006,How to Measure Pedagogy Success,"pedagogy,KPIs,metrics,measurement,performance,education training",guide
C0007,Leveraging Lean Startup for Business Growth,"lean startup,growth,business,strategy,marketing,entrepreneurship management",article
C0008,How to Optimize Accessibility Performance,"accessibility,optimization,performance,engineering,advanced,design creative",article
C0009,How to Build a Successful B2B Marketing Strategy,"b2b marketing,strategy,business,growth,planning,marketing communication",article
C0010,How to Measure SQL Success,"sql,KPIs,metrics,measurement,performance,data analytics",guide
C0011,The Complete Guide to Partnership,"partnership,guide,comprehensive,professional,learning,sales business development",guide
C0012,Introduction to CI/CD with Python,"python,ci/cd,beginner,tutorial,programming,it software development",tutorial
C0013,Advanced DeFi Techniques in Python,"python,defi,advanced,data science,programming,finance banking",tutorial
C0014,Mastering Fundraising: From Zero to Hero,"fundraising,learning,career,skills,progression,entrepreneurship management",guide
C0015,Advanced Figma Techniques in Python,"python,figma,advanced,data science,programming,design creative",tutorial
C0016,How to Measure Design Systems Success,"design systems,KPIs,metrics,measurement,performance,design creative",guide
C0017,How TypeScript is Changing the Industry,"typescript,innovation,digital transformation,future,business,it software development",article
C0018,How to Measure XGBoost Success,"xgboost,KPIs,metrics,measurement,performance,data analytics",guide
C0019,Real-world Operations Case Studies,"operations,case study,industry,applications,business,entrepreneurship management",article
C0020,Advanced Curriculum Design Techniques in Python,"python,curriculum design,advanced,data science,programming,education training",tutorial
C0021,How to Build a Successful Smart Contracts Strategy,"smart contracts,strategy,business,growth,planning,finance banking",article
C0022,Getting Started with E-learning,"e-learning,beginner,introduction,learning,guide,education training",guide
C0023,Real-world Risk Management Case Studies,"risk management,case study,industry,applications,business,entrepreneurship management",article
C0024,Leveraging Remote Work for Business Growth,"remote work,growth,business,strategy,marketing,human resources",article
C0025,How Lean Startup is Changing the Industry,"lean startup,innovation,digital transformation,future,business,entrepreneurship management",article
C0026,Deep Dive into Social Media Algorithms,"social media,machine learning,algorithms,data science,python,marketing communication",tutorial
C0027,Advanced LMS Techniques in Python,"python,lms,advanced,data science,programming,education training",tutorial
C0028,Getting Started with Financial Analysis,"financial analysis,beginner,introduction,learning,guide,finance banking",guide
C0029,Getting Started with Instagram,"instagram,beginner,introduction,learning,guide,marketing communication",guide
C0030,How to Optimize Node.js Performance,"node.js,optimization,performance,engineering,advanced,it software development",article
C0031,Leveraging REST API for Business Growth,"rest api,growth,business,strategy,marketing,it software development",article
C0032,Leveraging Git for Business Growth,"git,growth,business,strategy,marketing,it software development",article
C0033,Typography Marketing Strategy That Actually Works,"typography,marketing,strategy,growth,ROI,design creative",article
C0034,How to Build a Successful Pedagogy Strategy,"pedagogy,strategy,business,growth,planning,education training",article
C0035,EdTech Interview Questions and Answers,"edtech,interview,hiring,recruitment,career,education training",tips
C0036,The Complete Guide to Statistical Analysis,"statistical analysis,guide,comprehensive,professional,learning,data analytics",guide
C0037,Gamification Trends to Watch in 2024,"gamification,trends,industry,future,innovation,education training",article
C0038,How to Build a Successful Lean Startup Strategy,"lean startup,strategy,business,growth,planning,entrepreneurship management",article
C0039,Leveraging HR Tech for Business Growth,"hr tech,growth,business,strategy,marketing,human resources",article
C0040,Introduction to Microlearning with Python,"python,microlearning,beginner,tutorial,programming,education training",tutorial
C0041,How Transformers is Changing the Industry,"transformers,innovation,digital transformation,future,business,data analytics",article
C0042,Advanced Risk Management Techniques in Python,"python,risk management,advanced,data science,programming,entrepreneurship management",tutorial
C0043,Top 10 Tools for Employee Engagement Professionals,"employee engagement,tools,productivity,software,recommendations,human resources",tips
C0044,Mastering Illustration: From Zero to Hero,"illustration,learning,career,skills,progression,design creative",guide
C0045,Elasticsearch Trends to Watch in 2024,"elasticsearch,trends,industry,future,innovation,it software development",article
C0046,Advanced Microlearning Techniques in Python,"python,microlearning,advanced,data science,programming,education training",tutorial
C0047,Wireframing vs Accessibility: A Complete Comparison,"wireframing,accessibility,comparison,analysis,engineering,design creative",comparison
C0048,Learning & Development Best Practices for 2024,"learning & development,best practices,software,engineering,tips,human resources",tips
C0049,Introduction to Inbound Marketing with Python,"python,inbound marketing,beginner,tutorial,programming,marketing communication",tutorial
C0050,TensorFlow vs Reinforcement Learning: A Complete Comparison,"tensorflow,reinforcement learning,comparison,analysis,engineering,data analytics",comparison
C0051,How to Measure Blockchain Success,"blockchain,KPIs,metrics,measurement,performance,finance banking",guide
C0052,How to Optimize VC Performance,"vc,optimization,performance,engineering,advanced,finance banking",article
C0053,How to Build a Successful PostgreSQL Strategy,"postgresql,strategy,business,growth,planning,it software development",article
C0054,Advanced Kubernetes Techniques in Python,"python,kubernetes,advanced,data science,programming,it software development",tutorial
C0055,Building a Brand Strategy Pipeline from Scratch,"brand strategy,python,engineering,hands-on,step-by-step,marketing communication",tutorial
C0056,Top 10 Tools for Fundraising Professionals,"fundraising,tools,productivity,software,recommendations,entrepreneurship management",tips
C0057,How to Build a Successful Partnership Strategy,"partnership,strategy,business,growth,planning,sales business development",article
C0058,GraphQL Best Practices for 2024,"graphql,best practices,software,engineering,tips,it software development",tips
C0059,Leveraging E-learning for Business Growth,"e-learning,growth,business,strategy,marketing,education training",article
C0060,SQL Marketing Strategy That Actually Works,"sql,marketing,strategy,growth,ROI,data analytics",article
C0061,Building a System Design Pipeline from Scratch,"system design,python,engineering,hands-on,step-by-step,it software development",tutorial
C0062,Mastering Learning & Development: From Zero to Hero,"learning & development,learning,career,skills,progression,human resources",guide
C0063,Mastering Motion Design: From Zero to Hero,"motion design,learning,career,skills,progression,design creative",guide
C0064,Introduction to Partnership with Python,"python,partnership,beginner,tutorial,programming,sales business development",tutorial
C0065,How to Optimize Negotiation Performance,"negotiation,optimization,performance,engineering,advanced,sales business development",article
C0066,How to Optimize Risk Management Performance,"risk management,optimization,performance,engineering,advanced,finance banking",article
C0067,Accessibility Trends to Watch in 2024,"accessibility,trends,industry,future,innovation,design creative",article
C0068,How to Measure DevOps Success,"devops,KPIs,metrics,measurement,performance,it software development",guide
C0069,Introduction to Email Marketing with Python,"python,email marketing,beginner,tutorial,programming,marketing communication",tutorial
C0070,Building a Risk Management Pipeline from Scratch,"risk management,python,engineering,hands-on,step-by-step,finance banking",tutorial
C0071,Design Systems Trends to Watch in 2024,"design systems,trends,industry,future,innovation,design creative",article
C0072,How to Optimize Strategic Planning Performance,"strategic planning,optimization,performance,engineering,advanced,entrepreneurship management",article
C0073,Leveraging Instagram for Business Growth,"instagram,growth,business,strategy,marketing,marketing communication",article
C0074,Deep Dive into Design Systems Algorithms,"design systems,machine learning,algorithms,data science,python,design creative",tutorial
C0075,How to Measure React Native Success,"react native,KPIs,metrics,measurement,performance,it software development",guide
C0076,Mastering SaaS Sales: From Zero to Hero,"saas sales,learning,career,skills,progression,sales business development",guide
C0077,Data Visualization vs NLP: A Complete Comparison,"data visualization,nlp,comparison,analysis,engineering,data analytics",comparison
C0078,How to Optimize Cold Outreach Performance,"cold outreach,optimization,performance,engineering,advanced,sales business development",article
C0079,Leveraging Agile for Business Growth,"agile,growth,business,strategy,marketing,entrepreneurship management",article
C0080,Building a Strong TensorFlow Culture,"tensorflow,culture,team,management,leadership,data analytics",article
C0081,Cold Outreach Marketing Strategy That Actually Works,"cold outreach,marketing,strategy,growth,ROI,sales business development",article
C0082,Personal Branding Trends to Watch in 2024,"personal branding,trends,industry,future,innovation,marketing communication",article
C0083,Introduction to Employee Engagement with Python,"python,employee engagement,beginner,tutorial,programming,human resources",tutorial
C0084,The Complete Guide to Onboarding,"onboarding,guide,comprehensive,professional,learning,human resources",guide
C0085,How to Optimize Visual Identity Performance,"visual identity,optimization,performance,engineering,advanced,design creative",article
C0086,How Diversity & Inclusion is Changing the Industry,"diversity & inclusion,innovation,digital transformation,future,business,human resources",article
C0087,How to Measure HR Tech Success,"hr tech,KPIs,metrics,measurement,performance,human resources",guide
C0088,Leveraging PyTorch for Business Growth,"pytorch,growth,business,strategy,marketing,data analytics",article
C0089,How to Measure Data Visualization Success,"data visualization,KPIs,metrics,measurement,performance,data analytics",guide
C0090,Building a Fundraising Pipeline from Scratch,"fundraising,python,engineering,hands-on,step-by-step,entrepreneurship management",tutorial
C0091,Introduction to React Native with Python,"python,react native,beginner,tutorial,programming,it software development",tutorial
C0092,Advanced Financial Modeling Techniques in Python,"python,financial modeling,advanced,data science,programming,finance banking",tutorial
C0093,How to Measure Curriculum Design Success,"curriculum design,KPIs,metrics,measurement,performance,education training",guide
C0094,Top 10 Tools for Negotiation Professionals,"negotiation,tools,productivity,software,recommendations,sales business development",tips
C0095,How to Optimize Change Management Performance,"change management,optimization,performance,engineering,advanced,entrepreneurship management",article
C0096,Top 10 Tools for SaaS Sales Professionals,"saas sales,tools,productivity,software,recommendations,sales business development",tips
C0097,Real-world Learning & Development Case Studies,"learning & development,case study,industry,applications,business,human resources",article
C0098,How B2B Marketing is Changing the Industry,"b2b marketing,innovation,digital transformation,future,business,marketing communication",article
C0099,Instagram Marketing Strategy That Actually Works,"instagram,marketing,strategy,growth,ROI,marketing communication",article
C0100,Advanced Conversion Rate Techniques in Python,"python,conversion rate,advanced,data science,programming,marketing communication",tutorial
C0101,Building a Networking Pipeline from Scratch,"networking,python,engineering,hands-on,step-by-step,entrepreneurship management",tutorial
C0102,Advanced Prototyping Techniques in Python,"python,prototyping,advanced,data science,programming,design creative",tutorial
C0103,Top 10 Tools for Supply Chain Professionals,"supply chain,tools,productivity,software,recommendations,entrepreneurship management",tips
C0104,Advanced Revenue Growth Techniques in Python,"python,revenue growth,advanced,data science,programming,sales business development",tutorial
C0105,Getting Started with Talent Acquisition,"talent acquisition,beginner,introduction,learning,guide,human resources",guide
C0106,Motion Design Marketing Strategy That Actually Works,"motion design,marketing,strategy,growth,ROI,design creative",article
C0107,Copywriting Trends to Watch in 2024,"copywriting,trends,industry,future,innovation,marketing communication",article
C0108,Top 10 Tools for Statistical Analysis Professionals,"statistical analysis,tools,productivity,software,recommendations,data analytics",tips
C0109,Supply Chain Trends to Watch in 2024,"supply chain,trends,industry,future,innovation,entrepreneurship management",article
C0110,Leveraging Diversity & Inclusion for Business Growth,"diversity & inclusion,growth,business,strategy,marketing,human resources",article
C0111,How to Optimize CI/CD Performance,"ci/cd,optimization,performance,engineering,advanced,it software development",article
C0112,Building a Negotiation Pipeline from Scratch,"negotiation,python,engineering,hands-on,step-by-step,sales business development",tutorial
C0113,How to Optimize Curriculum Design Performance,"curriculum design,optimization,performance,engineering,advanced,education training",article
C0114,The Complete Guide to Transformers,"transformers,guide,comprehensive,professional,learning,data analytics",guide
C0115,Building a Strong Compensation Culture,"compensation,culture,team,management,leadership,human resources",article
C0116,Revenue Growth Marketing Strategy That Actually Works,"revenue growth,marketing,strategy,growth,ROI,sales business development",article
C0117,Real-world Community Management Case Studies,"community management,case study,industry,applications,business,marketing communication",article
C0118,REST API Marketing Strategy That Actually Works,"rest api,marketing,strategy,growth,ROI,it software development",article
C0119,Advanced Google Ads Techniques in Python,"python,google ads,advanced,data science,programming,marketing communication",tutorial
C0120,Getting Started with Content Marketing,"content marketing,beginner,introduction,learning,guide,marketing communication",guide
C0121,Leveraging B2B Marketing for Business Growth,"b2b marketing,growth,business,strategy,marketing,marketing communication",article
C0122,Mastering WebSockets: From Zero to Hero,"websockets,learning,career,skills,progression,it software development",guide
C0123,Leveraging TensorFlow for Business Growth,"tensorflow,growth,business,strategy,marketing,data analytics",article
C0124,Real-world Revenue Growth Case Studies,"revenue growth,case study,industry,applications,business,sales business development",article
C0125,Financial Modeling Marketing Strategy That Actually Works,"financial modeling,marketing,strategy,growth,ROI,finance banking",article
C0126,Getting Started with Storytelling,"storytelling,beginner,introduction,learning,guide,marketing communication",guide
C0127,Leveraging Influencer Marketing for Business Growth,"influencer marketing,growth,business,strategy,marketing,marketing communication",article
C0128,Top 10 Tools for Pandas Professionals,"pandas,tools,productivity,software,recommendations,data analytics",tips
C0129,Email Marketing vs SEO: A Complete Comparison,"email marketing,seo,comparison,analysis,engineering,marketing communication",comparison
C0130,How to Optimize Gamification Performance,"gamification,optimization,performance,engineering,advanced,education training",article
C0131,How to Measure WebSockets Success,"websockets,KPIs,metrics,measurement,performance,it software development",guide
C0132,Building a Strong LMS Culture,"lms,culture,team,management,leadership,education training",article
C0133,Introduction to Storytelling with Python,"python,storytelling,beginner,tutorial,programming,marketing communication",tutorial
C0134,Risk Management Trends to Watch in 2024,"risk management,trends,industry,future,innovation,finance banking",article
C0135,The Complete Guide to System Design,"system design,guide,comprehensive,professional,learning,it software development",guide
C0136,Networking Trends to Watch in 2024,"networking,trends,industry,future,innovation,entrepreneurship management",article
C0137,Getting Started with Feature Engineering,"feature engineering,beginner,introduction,learning,guide,data analytics",guide
C0138,Mastering Sales Pipeline: From Zero to Hero,"sales pipeline,learning,career,skills,progression,sales business development",guide
C0139,Gamification vs Online Teaching: A Complete Comparison,"gamification,online teaching,comparison,analysis,engineering,education training",comparison
C0140,Introduction to System Design with Python,"python,system design,beginner,tutorial,programming,it software development",tutorial
C0141,Introduction to LMS with Python,"python,lms,beginner,tutorial,programming,education training",tutorial
C0142,How to Build a Successful VC Strategy,"vc,strategy,business,growth,planning,finance banking",article
C0143,How to Optimize Crypto Performance,"crypto,optimization,performance,engineering,advanced,finance banking",article
C0144,Getting Started with VC,"vc,beginner,introduction,learning,guide,finance banking",guide
C0145,The Complete Guide to Visual Identity,"visual identity,guide,comprehensive,professional,learning,design creative",guide
C0146,Top 10 Tools for Remote Work Professionals,"remote work,tools,productivity,software,recommendations,human resources",tips
C0147,How to Measure Strategic Planning Success,"strategic planning,KPIs,metrics,measurement,performance,entrepreneurship management",guide
C0148,How to Measure Negotiation Success,"negotiation,KPIs,metrics,measurement,performance,sales business development",guide
C0149,Mastering Microlearning: From Zero to Hero,"microlearning,learning,career,skills,progression,education training",guide
C0150,How to Optimize Compensation Performance,"compensation,optimization,performance,engineering,advanced,human resources",article
C0151,How Data Cleaning is Changing the Industry,"data cleaning,innovation,digital transformation,future,business,data analytics",article
C0152,Email Marketing Interview Questions and Answers,"email marketing,interview,hiring,recruitment,career,marketing communication",tips
C0153,Leveraging Crypto for Business Growth,"crypto,growth,business,strategy,marketing,finance banking",article
C0154,Introduction to Microservices with Python,"python,microservices,beginner,tutorial,programming,it software development",tutorial
C0155,Leveraging Computer Vision for Business Growth,"computer vision,growth,business,strategy,marketing,data analytics",article
C0156,Getting Started with Blockchain,"blockchain,beginner,introduction,learning,guide,finance banking",guide
C0157,Leveraging Leadership for Business Growth,"leadership,growth,business,strategy,marketing,entrepreneurship management",article
C0158,Top 10 Tools for Code Review Professionals,"code review,tools,productivity,software,recommendations,it software development",tips
C0159,Leveraging Curriculum Design for Business Growth,"curriculum design,growth,business,strategy,marketing,education training",article
C0160,Deep Dive into Git Algorithms,"git,machine learning,algorithms,data science,python,it software development",tutorial
C0161,Revenue Growth vs B2B Sales: A Complete Comparison,"revenue growth,b2b sales,comparison,analysis,engineering,sales business development",comparison
C0162,Deep Dive into EdTech Algorithms,"edtech,machine learning,algorithms,data science,python,education training",tutorial
C0163,Introduction to TypeScript with Python,"python,typescript,beginner,tutorial,programming,it software development",tutorial
C0164,Top 10 Tools for Social Media Professionals,"social media,tools,productivity,software,recommendations,marketing communication",tips
C0165,Top 10 Tools for People Analytics Professionals,"people analytics,tools,productivity,software,recommendations,human resources",tips
C0166,Building a Supply Chain Pipeline from Scratch,"supply chain,python,engineering,hands-on,step-by-step,entrepreneurship management",tutorial
C0167,How to Measure Time Series Success,"time series,KPIs,metrics,measurement,performance,data analytics",guide
C0168,Real-world Performance Management Case Studies,"performance management,case study,industry,applications,business,human resources",article
C0169,Innovation Marketing Strategy That Actually Works,"innovation,marketing,strategy,growth,ROI,entrepreneurship management",article
C0170,The Complete Guide to Spring Boot,"spring boot,guide,comprehensive,professional,learning,it software development",guide
C0171,Building a LMS Pipeline from Scratch,"lms,python,engineering,hands-on,step-by-step,education training",tutorial
C0172,Curriculum Design Best Practices for 2024,"curriculum design,best practices,software,engineering,tips,education training",tips
C0173,Curriculum Design Marketing Strategy That Actually Works,"curriculum design,marketing,strategy,growth,ROI,education training",article
C0174,Top 10 Tools for Design Thinking Professionals,"design thinking,tools,productivity,software,recommendations,design creative",tips
C0175,How Sales Pipeline is Changing the Industry,"sales pipeline,innovation,digital transformation,future,business,sales business development",article
C0176,B2B Sales Best Practices for 2024,"b2b sales,best practices,software,engineering,tips,sales business development",tips
C0177,Real-world UI Design Case Studies,"ui design,case study,industry,applications,business,design creative",article
C0178,Business Model Trends to Watch in 2024,"business model,trends,industry,future,innovation,entrepreneurship management",article
C0179,Top 10 Tools for SaaS Professionals,"saas,tools,productivity,software,recommendations,entrepreneurship management",tips
C0180,Deep Dive into Talent Acquisition Algorithms,"talent acquisition,machine learning,algorithms,data science,python,human resources",tutorial
C0181,Cold Outreach vs Partnership: A Complete Comparison,"cold outreach,partnership,comparison,analysis,engineering,sales business development",comparison
C0182,Figma vs Color Theory: A Complete Comparison,"figma,color theory,comparison,analysis,engineering,design creative",comparison
C0183,Real-world Sales Pipeline Case Studies,"sales pipeline,case study,industry,applications,business,sales business development",article
C0184,Design Systems vs User Research: A Complete Comparison,"design systems,user research,comparison,analysis,engineering,design creative",comparison
C0185,Building a Strong NLP Culture,"nlp,culture,team,management,leadership,data analytics",article
C0186,How to Measure Git Success,"git,KPIs,metrics,measurement,performance,it software development",guide
C0187,React Native Trends to Watch in 2024,"react native,trends,industry,future,innovation,it software development",article
C0188,Getting Started with Diversity & Inclusion,"diversity & inclusion,beginner,introduction,learning,guide,human resources",guide
C0189,Advanced Change Management Techniques in Python,"python,change management,advanced,data science,programming,entrepreneurship management",tutorial
C0190,How to Measure Gamification Success,"gamification,KPIs,metrics,measurement,performance,education training",guide
C0191,Top 10 Tools for CI/CD Professionals,"ci/cd,tools,productivity,software,recommendations,it software development",tips
C0192,Marketing Analytics Interview Questions and Answers,"marketing analytics,interview,hiring,recruitment,career,marketing communication",tips
C0193,Introduction to Cold Outreach with Python,"python,cold outreach,beginner,tutorial,programming,sales business development",tutorial
C0194,Team Management Best Practices for 2024,"team management,best practices,software,engineering,tips,entrepreneurship management",tips
C0195,Getting Started with Performance Management,"performance management,beginner,introduction,learning,guide,human resources",guide
C0196,Real-world Inbound Marketing Case Studies,"inbound marketing,case study,industry,applications,business,marketing communication",article
C0197,How to Build a Successful Typography Strategy,"typography,strategy,business,growth,planning,design creative",article
C0198,The Complete Guide to Employer Branding,"employer branding,guide,comprehensive,professional,learning,human resources",guide
